text with images,2_way_label
my walgreens offbrand mucinex was engraved with the letters mucinex but in a different order,1
hackers leak emails from uae ambassador to us,1
puppy taking in the view,1
bride and groom exchange vows after fatal shooting at their wedding,1
major thermos,0
rabbi meat from cloned pig could be kosher for jews to eat with milk,1
cutouts,0
jesus christ converting local teens to christianity repainted and then circa ad,0
victory the great european crusade vichy france,0
english village becomes climate leader by quietly cleaning up its own patch,1
i aint flying over no moon,0
seven doggly sins sloth,0
cutest baby cow ive seen in my head all day and just enjoy destiny for what it is,0
asian girl wearing virtual reality goggles holding a very surprised looking cat,1
the way the rain made a silhouette of my bike,1
how to selfdiagnose yourself with a mental illness in easy steps,0
love and peace the washington way soviet union,0
a view of london that you can only see from the strangers bar in the palace of westminster,1
what goes best with genocide red or white i can never remember,0
happy boat with some friends,0
the tree was angry at me for felling it,0
governor chris christie reacts to a statement in an interview,1
applying to join the chinese communist party music video w english subtitles,0
my dads neighbor used to own ambulance company he is moving so we got to see this,1
are you not entertained,0
creepy guy with creepy hair staring creepily,1
rain made this iron slab wall a beautiful red,1
president making a point in the parliament,1
stewie,0
destiny finally comes to pc on steam but theres a big catch,0
piglets on the loose after truck overturns,1
quick and obvious,0
happy fella in my penske rental,0
oo,0
a sun bear sitting down x,1
not sure how i feel about this,1
fine sushi,0
this car has a door bolt,1
the shadow,1
el chapo escapes altiplano prison th,0
this lighting desk has oops and please keys,1
excited ashtray,0
this image of spike lee and sam jackson at the oscars,1
this is what it looks like behind the dome screen of an omnimax museum theatre,1
report reveals jesus christ have benefited from fathers influential position to gain highpowered role as lord and savior,0
barack obama dancing with ellen degeneres,1
quit horsing around,0
comfort cases former foster child helps other kids in foster care,1
other discussions,0
available here,0
a tattoo artist is covering up the scars of people who have overcome self harm for free,1
this little guy stuck in the snow,0
a wedding to bark about,0
looter land,0
your cable company would hate us if it knew we told you about this device on amazon,0
theres only one girl in this picture for me,0
the difference the light makes on these tiles,1
a fish in the new england aquarium,1
he cant do it alone proempire long long ago date unknown,0
the flying tigers of the free world strike again korean warera leaflet,0
im not entirely sure where i was going with this,0
imgur,0
scooty puff jr,0
mini wireless keyboard lighter for scale,1
the future of paris,1
rules of an immoral park,1
cop brought to tears by mans request after traffic stop,1
i want ice cream,0
whats worse than lobsters on your piano crabs on your organ,0
how do you get such a perfect photo,0
enjoying the view,0
king kong vs godzilla,0
meal deal,0
duckline bling,0
kim derpun,0
nice human,0
what does this creature want from me heat me up with some good music,0
the notes on a conditional form,0
this trophy for best corn,1
the reinforcement on these identical pieces of duplo lego,1
at halftime of sdsus basketball game they auction off a pig,1
revolution syria,0
this spider on my back porch disguises itself as a stick to fool prey,1
in just over two years the copper in my iems has turned green new pair to the right for comparison,1
the way this mosquitorepellant spiral burned,1
you are about to embark upon the great crusade toward which we have striven these many months,0
skiing man,0
they live,0
earthquake,0
ronald reagan getting shot at a attempted murder cira,0
a dying bee in a park on a grilled onion,1
rc car controller cannot unsee,0
this otter going down a slide,0
reports pregnant popeyes manager fired after refusing to pay for armed robbery,1
the stoplights in akureyri iceland,1
your friendly neighborhood mayor,0
just ate a fresh apple and found germinating pips inside,1
other discussions,0
lost dog shows she nose her way to owners workplace,1
wish granted,0
dont talk to me or my son ever again,0
i was always euroskeptic claims cameron despite leading remain campaign,1
riding on some weird guy in stockholm,0
meth,0
justin bieber trying to sneak out of a brothel with his bodyguards,1
this rock in trinidad looks like an air jordan,1
candy kingdoms giant protection sphere,0
what does this smell like to you,0
argetinas football squad celebrate a goal during the world cup,0
boston nurse has donated gallons of blood over last years,1
paul rudd first job,0
my printers paper guide is not having a good day,0
imagine having to pay more to visit funwaacom so join the battle for net neutrality,0
i rarely use my stapler so i guess its accurate that it is a sloth,0
you really have to look,0
feds nsa probably spies on members of congress,1
cutouts,0
better late than never,0
the movie,0
flying goalkeeper,1
i was just minding my own business at work taking some pictures when i noticed this goofy guy smiling at me,0
allegory of emperor pedro ii of brazil art by henrique fluiess,0
how to have sex with a flowercovered roof used as a human shield on a bridge,0
five shot in downtown seattle near scene of antitrump protests,1
this kitty has a small cat face on its forehead,0
i fell asleep on the remote,1
hidden lake and reynolds mountain glacier nation park montana,0
this picture of obama in a scotland airbnb,1
the handrail at the top of castel santelmo in naples has braille,1
ssssmokin,0
special edition,0
this hedgehog and golden retriever wearing beanies,1
smoking skull,0
thats not his hair,0
box of chocolates,0
this tree is split right open,1
i have always enjoyed reading uplifting news but creating uplifting news is so much better check out my free dad and daughter hair classes thank you,1
flooded city,0
man plays with his newly purchased nintendo labo,0
happy plum,0
israelsoviet union friendship poster made by the israeli communist party,0
federal judge rules separated families must be reunited within days,1
nasa documents showing mission plans for apollo landing,0
father and son in stormtrooper outfit,1
campfire time,0
kids,0
rushmore,0
dont call me shirley,0
this is what can be expected if europe succumbs to bolshevism,0
an american soldier loads his shotgun before charging into german trenches,0
grinchy guns and jesus,0
toddler playing sheep decides to play with baby jesus during nativity play,1
flipped over wheeler on fire rpics,1
drunk octopus,0
buff,0
i fucking knew he was real,0
they phoned me with shocking news,0
this cat surrenders from raww,1
my fencepost is a happy camper,0
historical footage of the last trex serving his country in ww,0
this melted car in lille france,1
my cats fur is smokey hes a black cat with a snow white undercoat,1
americas got kitties,0
robot mole on mars begins digging into red planet this week,1
girl with swimming noodles,1
amazing lego sculptures put all around san antonio botanical garden to brighten the experience,1
heavy rotation end of an empire,0
more beer more awesome,0
cat why so serious,1
first sled ride,1
happy frog backpack,0
sphinx,0
stamped a stamp on top of another stamp perfectly symmetrically to create a cool pattern,1
sad jordan sorry,0
the froth on top of my coffee is the same color as the cup makes it look empty,1
mickey mouse power line pole,1
mick jagger and art garfunkel recording an unreleased album,0
gang violence in los santossan andreas,0
k,0
awe yeaaaaahhh,0
in the wake of police unlawfully detain a muslim woman,0
tunnel collapse have killed after north korea nuclear test japanese broadcaster,1
not a single fuck was given,0
i love clubbing,0
jurassic party,0
guy contemplating life under pressure,1
could be worse,0
a dog with its head in a gate,1
flag for glitch,0
a drowned scorpion centipede and lizard pulled from the bottom of a pool,1
major democratic donor ed buck arrested charged with running drug den,1
a former red beret soldier recounts his experience s of the vietnam war on a news report on,0
rock face,0
bunny derp lost in space,0
cellphone tower zone map of california,0
alignment of completely independent variables necessary for man to feel okay,0
margaret thatcher hashtag confuses cher fans,1
the guardian of the baby,0
coffee is awesome,0
ilya repin demonstration on,0
man dodges armed robbers bullets to protect his louis vuitton bag he can pry it out of my cold dead hands,1
snake warrior,0
one in eight young people in the uk have never seen a real cow,1
i was born with a leg defect that makes my knee face inwardson the sides of my legs my fun party trick,1
save the children,0
tutankhamuns mumified hog c bc stolen before burial by ankhesenamun as a memento,0
girl about to head a soccer ball,1
quiz how many of these things have you shouted while falling to your death at fao schwarz,0
this bowl has a built in chopstick holder,1
fbis comey says obama did not order wiretapping of trumps new york office regarding fbi involvement in testimony before house intelligence committee,1
a lamp made my physics notebook look like the surface of the moon,1
exit caffrey enter alphie,0
i come in peace,0
why walk,0
scotland forever,0
knocked my sawhorse over and cracked open the layers of paint ive sprayed,1
my cat brought in a foetus,1
axis workers get no wages wwii poster thirteenth naval district,0
haaaaaaaaaaaaaaaaaaaa,0
when to stand to get a good picture,1
end of the checkout line the looming crisis for american cashiers,1
my first attempt at a removal,0
eu memers seeking asylum in america,0
clouds photographed by an international space station astronaut orbiting over canada latitude longitude on,1
at first i was told this gator my best friends finally got the traffic sign,0
twofer,0
watching reruns and todays date appeared on the show,1
on rainy days even the umbrella bags feel a little sadder,0
how russia persecutes its dissidents using us courts,1
terrier,0
david cameron to apologize for saying queen purred over scottish vote result,1
patent troll asks judge for gag order to silence opponent,1
stares at me when im going to the bathroom,0
the trump administration is threatening to publicly release the private data of immigrants and foreign visitors,1
post game thread the minnesota timberwolves are in the middle of the challenges was awarded a vintage delorean,0
japan moments before attacking pearl harbour,0
sheryl sandberg says these words are the best career advice she ever got,0
stairs to nowhere self titled,0
rubber ducks in a pool,0
tyrion lannister dog,0
you are one of us too pronazi belgium,0
my fiancee found this big chunk of peanut butter in her reeses puffs box this morning,1
the way these shadows are casted during golden hour,1
golfer finally wins her club championship after years of trying,1
rare photo of nazi party member reading mien kampf circa,0
im gonna get you,0
i guess i have to start carving,1
no child left behind,0
monstro,0
accurate enough,0
new xmen villain concept art latheneto,0
one could be your next door neighbor,0
nirvana releases nevermind,0
other discussions,0
nate diaz daps up shaq,1
me enjoying my cake day,0
sun bears,1
its fucking raw,0
us wind and solar power helped prevent up to deaths,1
home grown eggplant,1
i saw a gas station in the middle of the water,1
doggy daycare,1
ninja baby,0
frog getting eaten by a snake,1
the veins of this desert,1
my first thought,0
what can i get you sir,0
other discussions,0
did anyone else notice his sweater,0
mother lets it all hang out nsfw,0
at the mall theres a power outlet on the ceiling,1
dogwood,0
daylight savings time poster,0
a guy trying to drink from a waterfall,1
wild animals trampled by turtles,0
each kolkhoz and plant will give a pilot to our air fleet ussr s,0
this shopping cart has an idle directory so you dont have to wander,1
toilet paper security level master lock,1
unhealthy darth vader,0
all our yesterdays we do what we can,0
use of deadly force by police disappears on richmond streets,1
hooter with hooters,0
the latest winter fashion trend,0
still waitingshes starting to get a little uneasy,0
big kitty yawns on a ball pit,1
viacoms proposed nickelodeonthemed floating resort to be situated at coron palawan released,0
a kid is sitting on erdogans lap,1
my friend playing hacky sack on our lunch,1
this dispatcher actually has no idea what it is tests have been sitting there for years,0
baby spiders next to mama,1
scientists discover new alien plant hybrid,0
man drives miles to deliver crosses for orlando victims,1
tree swallowing its metal guard,1
this spilled lotion that looks like a sock,1
concerned russian citizen asks an important question,0
this tree disapproves of your shenanigans,0
thats not her hand,0
the war never ends,0
the cathedral in valencia houses the holy grail made in the first century bc,1
them ice baths end today kafish,0
us britain france others skip nuclear weapons ban treaty talks,1
cutouts,0
paranoid milk dispenser at the midway airport,0
this statue in a museum,1
this picture of jeanclaude juncker theodor waigel drinking beer,1
this statue of a boy riding a speeder bike,1
where do his hands go trump takes aim at al frankenstien over groping claims,1
this mm did not get its outer coat of sugar,1
hugh jackman lifting weights,1
north korea condemns us travel ban,1
cat got your tail,0
hes really pleased with his new haircut,0
bffs with pallas cat,0
he tried to stop him,0
this pigeon with a missing finger,1
british red cross raises over m during manchester benefit concert bringing total to m,1
giant cat in the fields,0
the inside temp of our rd floor building ceiling ouch,1
man hugging his displeased dog,1
maam,0
a guy and his dog about to eat a birthday meal x,1
found a rock painted like the yellow mm,1
nothing the turtles cant handle,0
att customer politely emails ceo gets terse reply from att lawyer,1
the more things change the more they stay the same,0
kim jongun squatting and looking at a glass bottle,1
misty canoe ride,0
the man who stole a plane said he didnt need much help ive played some video games,1
worst rockettes show ever,0
adding the final spice,0
trade war threatens to destabilize maine lobster industry at peak season,1
man standing in front of a shelf holding huge tits sfw,1
symbiosis,0
ref brutality,0
jose mourinho squatting,1
puerile,0
a selfie near the bubble pods resort in jordan,1
this picture autographed by william shatner,1
this is what pure rock looks like,0
planes uh find a way,0
the freezer condensed the glue on this cork and made the little plastic top come off,1
a city in indonesia photographed from the international space station on,1
this guy is patiently waiting for my phone calls,0
this picture i took of my dog makes it look like he was the one that took the photo,1
santorum takes in the south,1
obligatory birdswitharms edit,0
stills from the new flash movie got leaked,0
in an airport garage remnants of someones fun weekend,1
cheers,0
something about a cold one,0
this girl is trying to make disneyland pay for her college tuition,0
unimpressed fisherman,1
state cracks down on senior citizen euchre,1
palm jebel ali dubai united arab emirates photographed on from outer space by an international space station astronaut,1
other discussions,0
a curious bambi,0
interpretive art,0
laughing cheetahs,1
the unimpressive interview,0
extreme court justices relaxing at the end of the day,0
rival football teams work together to allow a teenager with cerebral palsy to score a touchdown,1
the secret life of pets,0
there is a longlegged distressed creature in my ice cream,0
emperor tiberius of the roman empire declaring his support for boris johnson in his run to be the next prime minister c ad,0
just what i need,1
the name of the small town where i waited for my train was named redditt,1
who keeps stealing our laundry,0
crying james,0
ocnsfw playboys miss was found in a timecapsule on fort bragg nc,1
he also won the lottery,0
hunger games,0
paw patrol selftitled,0
knights of teal attack,0
mommy didnt cook any dinner,0
this spiders color,1
when your outfit matches the houses,1
a young gay couple make out in front of good boy christians,0
ema tablet found outside the kasugataisha shrine in nara,1
everybody is cheeeeeering,0
dog in a blanket on a boat,1
colin kaepernick returns to football,0
shaq loves his dog,0
nanga parbat the rescue team finds first of the missing alive,1
hey guys what are you up to gettin recycled too huh yeah super cool cooooolio coolness,0
i didnt do it,0
damnit jim im a toolbox not a sandwich press,0
unacceptableuse right side up,0
this is a cardboard scratcher seemed like a little hurricane survivor,0
this guy in a nature catalogue toasting a poptart using a stick over a fire,1
another shot of the blue angels right before they broke formation over epcot,1
beautifully colored feather,0
peep show,0
gross doctors recommend drinking warm cups of clam juice a day,0
i am a terrible person,0
i know we die after mating but i just want to jump through glass desk,0
us senator bans funding for beerbots that dont exist,1
a seal whispering something to an excited girl from rpics,1
dont move it cant see us if we dont oh wait thats rexs just stfu,0
toddler enjoying an afternoon of tobogganing with her mother,1
oh no,0
renty only the innocent survive,0
aerial view of football stadium,0
i feel like im being watched,0
and this has come up before and he still has a sweet tooth for rodents,0
showin off his ride,0
a friendly game of golf nsfwish gore,0
this towel hook in my parents bathroom,1
the good ole days,0
moose seen floating on lone iceberg in north dakota river,1
for anyone who fancies trolling ratheism,0
many people dropping mentos into diet coke simultaneously,1
s soviet poster literacy is the road to communism,0
this dogs head and legs,1
if it wasnt for you meddling kids,0
missouri police searching for marijuana in a stage cancer patients hospital room incites a viral video,1
uh genius billionaire playboy philanthropist,0
ss force prisoner onto train bound for auschwitz,0
black parents shocked when son was born white,1
catwalk yeah,0
its like looking in the mirror,0
bill gates giving a speech,1
here,0
awardwinning lamb under investigation for performanceenhancing drugs,1
a goat wearing a crown this years king puck,1
this paved speed bump at an old house,1
nsfw,0
zooey deschanel was a boston bombing suspect according to fox news,1
local turkish barber in uk has made an amazing bouquet from local wildflowers including stinging nettles,1
boxboy off track ep,0
sleepy cookies,0
white house celebrates national freedom of information day by making office of the administration completely unfoiaable,1
this restaurant in china has an arcade machine that you can play for free,1
houston police put an end to the use of whataburger tents as crime scene markers,1
cryptocurrency transaction machine,1
highly detailed closeup picture of president donald j trumps penis taken by an advanced kremlin spy camera during trumps affair with stormy daniels,0
jurassic bark the furminator,0
yosemite valley in the fall,1
on this date the soviet union invaded australia,0
cia cash ends up in coffers of al qaeda,1
how twitter is changing modern warfare,1
how brussel sprouts grow,1
this guy was a bit heated,0
this fivelegged spider,1
picture of a clear american landscape before pollution,0
bounty hunters mistakenly target phoenix police chiefs house,1
ok who left a red towel in with the whites,0
larry donnell lost in fantasy football because he sat himself,1
this is what i think of nap time,0
told by the media,0
richard linklaters before sunrise,0
saw this truck driving around town the other day,1
other discussions,0
googles new controller cheesin for the cameras,0
north korea denies anthrax production invites obama to verify,1
community college students take nd in nasa robotics competition,1
dont ask me why,0
gandalfs apprentice,0
other discussions,0
the italian people turn on benito mussolini circa,0
mlb teams are coming together so this young fan with dprinted hand can throw out the first pitch at every ballpark,1
large man seated on even larger bench,0
brother the world famous typewriter,0
ingrid larson lucidity,0
texas churches sue fema for disaster relief after harvey,1
suicide by friday one last ride,0
dammit pip,0
a stretch of beach in southern manhattan under the brooklyn bridge looking east,1
slow down industrial worker usa,0
this dance off,1
distracted,0
fog in chicago,1
hes a good bowler,0
the amount of s in my smoothies best before date,1
left for dead in a plastic bag girl who overcame a lifetime of hardship now off to college,1
butterfly fresh out of the cocoon,1
caligula declares war on neptune circa ad,0
the retromantics good old days,0
baby born with most of skull missing celebrates first birthday,1
do the kimkim,0
like this,0
kim jongun climbs north koreas highest mountain,1
sing me a song,0
the twins,0
reasons meryl streep is overrated,0
heres my homage,0
why dont we have a game of riddles and if i win you show me the way out of here,0
years ago today,0
press start to play the trips,0
donald trump claps back at eminem with freestyle of his own,0
springfield man accused of cutting wifes throat,1
potus and lil pope,1
universal surprised bus thumb drive,0
this f in the chat shirt,1
parade of elephants arches national park utah,0
rantimlm prepare to take out pyramid schemes,0
oh yeah,0
tiny superheroes,1
spare some chains,0
this guy sniffing flowers by a womans butt,1
she has the cutest little tits,0
damnation,0
year old girl scowling,1
a philippine coin cents found in my yard from,1
edm concert lights,0
frog with insects in mouth,0
mother dog with her puppy in the back seat of a car,1
walmart carts in a target parking lot no walmart especially close either,1
this guys massive package on the tram,1
for me the sun rises and sets with her man,0
problem with beedrill in pewter city,0
holly madison reveals secrets from her relationship with hugh hefner this is disgusting consider us all scarred for life after hearing this this is disturbing,0
theres a golden kanye west joke somewhere in this but i couldnt find it,0
the flash in action,1
this baby walrus,0
eilmeldung trump nominiert vizeprasident,0
woof,0
cutouts,0
kevin spacey forces himself upon a young actor circa s,0
even plastic cups have joined the pumpkin craze,1
doggy with a treat,0
feed me wires,0
im the supreme commanderinchief of the wehrmacht meow,0
big wheel for adults,1
tired dog,1
these look oddly the same,1
mcconnell loves turtle comparisons,1
like this,0
rowdy pensioners pov,0
cutouts,0
this man who looks very much like colonel sanders standing unknowingly under a picture of colonel sanders,1
johane masowe members nearly murdered as punishment for being too popular,1
swim call in the gulf of aden,1
cnn ratings plummeted minus in just hours for naming a character act like strippers,0
shrooms growing out of the astro turf,1
alpacas with new hair cut,1
looked fun to makemy attempt,0
coming soon on ps,0
watch is watching,0
wheres the little boys room,0
what are you eating today,0
trump to be put on toddler leash after repeatedly getting lost around white house,0
legend has it he is the descendant of kylo ren,0
this seemingly portallike cloud i saw the other day,1
killed it on slitherio,0
human barbie takes off all make up the doctors are stunned,0
fist bump,1
ansonia man to be burned at stake admission free for kids under,1
sugar mouth take me to nirvana,0
chocolate seal,0
very subtle,0
come on it will be fun,0
oh please mccain doesnt even know what headphones are,0
us military considered food drops to lure north koreans away from nuclear sites,1
papa john announces hes suing papa johns,0
more than congo refugees seek refuge in angola,1
come on in america the bloods fine american neutrality in wwi,0
stabbed man called daughter from mcdonalds to cancel movie night,1
goalkeeper concedes goals then gets arrested,1
nordic countries and italy propose a pact,0
donald trump dictating his immigration reform january,0
about to make it rain,0
carlo is everywhere,0
i have no idea what im doing,0
the material that built the modern world is also destroying it heres a fix,0
house democrats want to know why a major russian moneylaundering case was abruptly settled,1
philippines anticipating chinese invasion by filling emergency storage with living essentials,0
ceiling cat origin,0
hedwig i thought you were dead,0
ey bss,0
cutouts,0
to ask eu for brexit date delay,1
asking for it,0
this derpy jalapeno i found while making dinner,0
nasa scrubs highly anticipated wallops island rocket launch will try again on tuesday,1
a small melted part of a television,1
shocked,0
this teacher from my facebook feed,0
italian troops in formation before the battle of el alamein,0
angry hedgehog attacking a couch bigger version,1
a single tiny cloud in otherwise clear skies at grand canyon,1
unamused auditross,0
this ice cream comes inside of a fruit shell instead of a paper cup,1
found a derek jeter baseball card from in my closet that was tucked away with other unopened card packs from the s,1
people and the army together warning watermark syria modern date na,0
this limited edition bag of cheetos,1
my dog after a bath,1
this photo of my grandpa turned purple after years,1
allied troops landing on omaha beach dday th,0
the lesser known elephant warrior in return of the king,0
georgia election server wiped after suit filed,1
condemning the military german left party sticker berlin with translation and commentary,0
a booty pic,0
shark attack,0
this little girl standing under a rainbow,1
heavy bob,0
