text with images,2_way_label
years of foot use,1
two headed mushroom,1
ah the good old days,0
no a new poll did not want to get in a crate,0
were doomed,0
australians we vote in a video recently claiming to be with those who hinder your progress,0
just trying to get fit when this douchebag came in and started heckling me,0
found this bubble still alive several hours after being created and landing on the grass,1
my watch was half covered by my sleeve so my lumen only got half charged,1
my chinese food has a carrot thats cut up like a fish,1
poll majority of americans want to keep obamacare,1
dat ass,0
latte art can be foam porn,0
myman,0
this man having fun at a party,1
im leaving now,0
down to earth sad spaceman,0
brokeback part this horse is getting too crowded,0
the pope kissing a boy,1
the doof warrior rides on the fury road,0
tiger mom gives birth yet nobody can believe what they find under her legs,0
arch duke ferdinands thoughts whilst publishing his cars route plan,0
new york jets owner accidentally favorites tweet calling for gm to be fired,1
nfl scouting combine to phase out subjecting draft prospects to vivisection,0
this red onion has alternating coloured layers,1
pretty halfnaked girl splashing water in her swimming pool,1
julius ceasar waving to his adoring subjects at an outdoor roman bath bc,0
water on purple ink the letters turned blue and bled pink,1
a penny from it says geordivs v dri gra britt omn rex fid def ind imp can anyone translate,1
foxy eyes,0
worlds biggest pet rock,0
a manifesto to save planet earth and ourselves,1
serenading stalin moscow nights,0
chipotles tortilla on the side looks like a chipotle pepper,1
chris bosh champagne celebrationbut what else is he doing,1
koalacat,0
football dude dancing,0
two flies getting it on rpics,1
how a group of teenagers convinced the utah legislature to recognize climate change,1
pesky cannibals,0
til that the media over the size of his presidency trump wages war with the secret service domestic terrorism is real,0
this paper someone stuck behind the magnet at my work,1
germanys newest pop star,0
donald trump hugging the us flag,1
this white wine is served in a bag of ice water,1
why tho,0
cutouts,0
this paper towel dispenser encourages not using your hands to dispense,1
meowblade purrnament,0
ask him ref,0
obligatory,0
caption,0
dream on dream on dream on dream on,0
in the town that i think maybe the folks who were buried in this tough time,0
obama with steven tyler and joe perry,1
httpsiimgurcomescfbjpg,0
perfectly crossaligned dice,1
this newborn giraffe,1
this restaurant in turkey has a mini masjid inside the restaurant complete with a wash station and turkisharabic quran books,1
obviously,0
the incendiaries some things never change,0
dog hit by trains miraculously survives,1
its got a great defense mechanism you dont dare kill it,0
fuck you pylon man get your own pylons,0
other discussions,0
other discussions,0
spanish and italian soccer players,1
my familys christmas photo which ever gets the most upvotes will be sent out christmas day to every member of my family,1
meh,0
nemesis arriving,0
found my first mutated leaf clover,1
nsw graffiti laws to also outlaw hopscotch squares abc news,1
solve this mystery,0
the way the command key in specific is worn after me using this keyboard for just under months,1
saw this driving up to connecticut,0
you arent fooling anyone clark kent,0
sk or die bro,0
hillary clinton and joe biden meet on the tarmac,1
lake winnipeg should be recognized as a person says advocate,1
new kaiju,0
this guy having a staring contest with a snake,1
rain demarcation line,1
spectacular performance,0
es mi pro pia vida abortion rights cartoon el salvador c,0
dorito nugget hopefully but we didnt bite it to find out measures about x,1
all in,0
my friends fitbit watch isnt impressed,0
alien abduction,0
four hoverboards from back to the future,0
finish her,0
theres probably one person on this site dieing to make a super dog out of this,1
other discussions,0
red star where is everyone,0
the most american flag i could have bought for christmas,0
a diamond merchant in india brightens the lives of each of his employees artisans and engineers by giving them the choice of a car flat condo or jewelry as a performance incentive for diwali the festival of lights,1
man nudes out at local pretzel stand,0
soul eater,0
in seal we trust,0
warren buffet backs billion dollar madness challenge,1
on my way steal yo girl,0
my cookie has a face,1
a robin williams tattoo i spotted at a concert a few years ago dont know whos it is but if you see this and its yours well done,1
yes,0
germanys victory europes freedom nazi germany date unknown,0
billy goats playing pool,0
the company forgot to print out the size quantity and item number,1
bears,0
x ray of my huawei mate pro,1
other discussions,0
nsfwoh no mr skeltal and his family when not on dootduty,0
death of julius caesar bc,0
my oddly wrapped roses chocolate,1
enlist artist fred spear usa,0
life this yearold never dreamed she would be able to vote for a woman to be president now she will as long as shes not too busy,0
the end is nigh,0
life is good,0
shredder,0
instructions on indian railway toilet written in braille,1
let herself go,0
my candle looks like a brain when it burns,1
well howdy,0
prize winning cake,1
my and my sisters bedroom lights make a perfect triangle,1
trump to announce us will exit paris climate deal,1
peter dinklage and his daughter,1
the airport was always the most popular stage in the game,0
it had to be done,0
the worlds largest furniture retailer ikea has revealed that of the materials used to make its products during were either renewable or recycled as it strives to reach the mark by,1
stop the repression in el salvador alto a la represion en el salvador poster by andrea kantrowitz with thanks to the league of revolutionary struggle marxistleninist,0
creepy cucumber,0
the obvious choice but still fun to make,0
my x is only about cm longer on each side than my x any cubers here,1
massive iguana,0
official rsavedyouaclick subscriber survey questions,0
excited santa claus,1
biden cheesing at the state of the union,1
highline walker,1
first thing that came to mind,0
i bought a little pot of daffodils to grow this one was the last to bloom and has eight petals,1
saw this sign when i was traveling in athens greece thought you might enjoy it,1
frances blaise matuidi awkward reaction front of a ball,1
australian surgeon gabrielle mcmullin stands by harassment remark,1
with sad kenyanu,0
this oddly groomed chinese crested from the westminster dog show,1
holes in my girlfriends jumper look like scared cats,1
a car parked in front of the castle in disney world in orlanda florida,0
i dont even know why i tried,0
badass,0
ac eyes,0
gesundheit,0
cutouts,0
birds oc,1
conflict arises between border security agent and illegal immigrant,0
fellowship of the most accurate,0
trucker pulling loose tooth triggers backup on alabama freeway report,1
this piece of cardboard packaging that looks like its screaming,1
last what,0
my coworkers hoodie has holes where your armpits go so you dont get sweaty,1
not enough pidgeon,0
trump deflects responsibility on yemen raid they lost ryan,1
httpsiimgurcomkhnmlybjpg,0
shay mitchell pierced something weve never thought to pierce,0
mccain shortly after voting against the aca,0
droeloe outside,0
us solar installations hit million mark,1
thought this little flower was pretty interesting,1
the john rylands library oc,1
this snail who has climbed up to my first storey window and spotted in different places during the past week or two,1
plop your infant in front of these pictures of gore vidal while you go spend a week in las vegas sponsored by the las vegas tourism board,0
