text with images,2_way_label
dog covered in tin foil,0
turnout for the first round of sabans power rangers auditions,0
wolf next to dead bison,1
a safe was sealed for years until a museum visitor spun the lock at random and opened it,0
this man has left written on his left shoe and right on his right shoe,1
super friends,0
my electronic cigarette doesnt seem to enjoy being sucked on,0
soviet trombonist turned soldier plays for a venomous cobra in afghanistan c,0
spent snapdragons are those poor unfortunate souls,0
he just struttin,0
sky panelling on the ceiling in a motorway service station bathroom,1
stories dont let the world consume you,0
dalit girl beaten up by women from higher caste because her shadow fell on their family,1
cutouts,0
i do not even,0
famous photo of muhammad ali standing over his opponent,1
cutouts,0
indonesia bans gay emojis,1
obligitory,0
other discussions,0
big bang,0
benito mussolini propagates his political party during great depression,0
a piece by w hogarths to demonstrate the importance of perspective,1
search it up its true,1
discoverys flyover of dc,1
mister thailand the fear of atomic energy,0
lets not fight any more,0
moonset,1
french cavalry charge foiled by german machine gun fire ww c,0
this italian candy labeled calories as energy,1
this bed for staging is fake,1
pete buttigieg and beto orourke at the democratic primaries circa,0
tommy wiseau filming the room,0
snails crawling in a line,1
theres a twerk in the engine,0
jj watt,1
the pride of philly,0
brave redditors destroy facebook hq decolorized,0
black stallion,0
kiss the pygmy,0
manufacturing defect on hardwood flooring,0
nasa is releasing their ballons in a war region,0
this picture of prince william and nick mason from pink floyd,1
good work sister we never figured you could do a mansize job americas women have met the test united states,0
available here,0
the way my cat was sitting earlier,0
we can do a lot more navy vet walks to raise awareness of veteran suicide homelessness,1
you did whaaat,0
this is every piece of paper from my three years of high school,1
ronda rousey says shed only fight floyd mayweather if they were dating,1
first edition of charles batteux groundbreaking book the beautiful art and principles of the meme he was a true visionary,0
engkilili infinitude in the finite,0
keep those pearly whites clean,0
a rather cute and happy smoke alarm,0
my airplanes shadow in a glory,1
the way this measuring cup that has been stuck has aged over the past decade,1
iron man looks on in terror while spiderman disintegrates,0
beyonces reaction to pharrells hat,1
devastating volcano eruption,0
this is one copy of the websters dictionary in braille,1
how i became fake news,1
jake gyllenhaal shutting up his coguest at a conference in ny,1
seconds later,0
fast and furious,0
texas yearold becomes youngest girl to climb mount kilimanjaro,1
rockin the reich,0
mongolia date unknown forward along the path of communism,0
vietnam war poster from the ussr,0
the character models on tf are so real,0
pearl harbor,0
mutant is a nerd,0
sad robot audio meters,0
pavement cracks look like picachu,1
bulky german and stripper russian prepare for a gay porn shoot,0
this silly flying pomeranian,1
toasty,0
elon musk why is my dolphin not working,0
directed by jj abrams,0
putin on a helluva show with kate bob and leftie,0
this,0
eggplant,0
a fight between two creatures,1
it was clearly on his mind,0
if he dove seconds sooner,0
after the hobbits,0
i found the skelton who doot nsfw,0
kings hawaiian sweet rolls,0
jaws,0
colorful sea snail shell i found,1
available here,0
i imagine their names are otis and carl,0
day they finally find me,0
kitten van buuren,0
the lone wanderer,0
a tasty piece of sushi,0
this cruise ship has sailed small exit signs on the floor dollar for scale,1
cheeeese,0
my local village has turned their old telephone box into a book swap,1
the obvious spy,1
miss man bombs walmart over confederate flag police,1
a series of british antisuffragette postcards based on the childrens rhyme this is the house that jack built in regards to the house of parliament published by birn brothers ltd approx,0
godspeed you black emperor we flew from the hazard temple,0
when youre hanging by a thread but you still find a place to lay your head,1
this took me a while,0
cognition brewery in ishpeming is continuing its effort to help raise money for homeless pets,1
yagrum balloon,0
freeeeeeeeeedoooooooooooooooooooooooom,0
p,0
gotcha,0
this rule should apply to customers in all fastfood retail chains,1
the crew of apollo boarding before liftoff their main objective being to collect cheese from the moon,0
the neighbor,0
always watching,0
blunt smoking son of alleged college admissions cheat gets his rap cd reviewed by nyp,1
the picture of a couple on the milk carton are also on the milk carton in their kitchen,1
what americans,0
this building looks like roberto the stabbing robot from futurama,0
because we dont get to see enough good cop stories on reddit,1
spilled water looks like a screaming skull,0
this guy has seen some shit,0
epcot is lit,0
found these happy little guys on instagram,0
i really dont know why,0
i drove an atv to the top of the judean mountains instantly thought of what you guysgals would come up with when i got home,1
quick someone call will smith and jeff goldblum,0
memory cove i prefer the loveliness and the terror x,0
just threw a dart into a concrete wall again my name is dave,1
a perfect photo of an orca,1
this graduation photo,1
groups warn teenagers warned over prinking craze,1
irans supreme leader pardons or reduces sentences for prisoners,1
insides of a tomato and a piece of cilantro look like a frog,0
pitt university newspaper condemning isis is offensive,1
hinge on the dentists xray looked worried for me,0
friendly alien face on a syringe tube,0
north korea nuclear negotiations,0
all for one one for all allied nations at beginning wwi,0
steve on percussion,0
chinese poster commemorating irish easter rising,0
bodies heads,0
id make that face too if some giant ate all my kin,0
they call him mellow yellow,0
astorias selftitled,0
oklahoma man burns to death sheriff not ruling out spontaneous combustion,1
iraq veteran and puppy reunited in us after months apart,1
homeowners shocked to find home for rent on facebook page,1
what the fuck is this man on the skate aaargh,0
baby puffer fish,1
bear hunting,0
the allies secret weapon during the war,0
battle of crecy colorised,0
kim jongun looks over a buffet,1
tame impala motionsickness,0
truth hurts,0
this fleshlight looks like it was modeled after patrick star nsfw,0
ooh me first,0
the amount of bumper stickers on this car,1
trinity help,0
those lucky times when you refresh your feed,1
come on youre not even bare foot,0
my phone is happy to see me,0
north korea unveils new mushroom sports drink,1
two men that went shopping together,1
this chair design,1
man aims to mow grass in all states for those in need,1
not amused,0
repordeer in the headlights,0
elijah wood and a fan,1
do you mind,0
my neighbour loves cars and just got his first one today along with his license thought id make his day with this present kacow,1
hes gonna eat that pasta,0
dancing with the stars,0
made it more renaissancey the cameras wasnt that high quality back then so i made it a little painting ish too,0
i was making milk tea and what was left at the bottom hardened to become this layer that just came off,1
emma gonzalez attacking a nd amendment supporters truck at a for our lives rally,0
what happens to styrofoam cups under immense preassure,1
get me off of this bus please,0
the real panda and the mascot panda,0
these pies seem happy,0
mayo clinic worker helps sick father surprise daughter at wedding,1
snail munching on a mushroom,1
new mexico bill would create first staterun pot shops in us,1
four of the same type of car in one parking lot,1
bull semen supply likely to resume in a month,1
reversed morals,0
coal miners laid off at wyoming county mine,1
under the sea,0
other discussions,0
facebomb,1
other discussions,0
poster about illegal migration from the mexican government full translation and info in comments,0
here you go,0
this dog,1
a photo of a horse wearing horse shoes before the metal variety were invented,0
happy tater,0
this cloud that looks like casper the friendly ghost,1
river surfer the canoes,0
lit a one year olds first birthday candle,0
no france will not become a colony americans in america poster made by the french communist party x,0
a tree noshing a sign,1
a tranny getting head from some lumberjack on the side of the road,0
jude law filming the new pope,1
quebec government moves to ban popular bilingual greeting bonjourhi,1
cutouts,0
my bell pepper had a bell pepper growing inside of it,1
australia senator malcolm roberts calls climate change a un conspiracy,1
alfred,0
these cats,1
auschwitz cooling showers leave visitors steaming,1
antivax mom defends her child colourized,0
captain smileye hit a tree,0
a tree stump grown in with the bar fence,1
my kids shirt has a recipe on the tag,1
goats are in the wing surface,0
vote for dewey kill the klan us presidential election,0
police investigating assault find apartment empty after hourslong standoff in oak cliff,1
from marsupial to mansupial in weeks click here,0
a provision snuck into the marriage as a pineberry a fruit that looks suspiciously like a guy and girl being hanged,0
ye,0
they put too much vanilla in my cappuccino,0
due to the high population of foreign language speakers living in this district this american elementary school has rooms labeled in english spanish and russian,1
robert downey jr throwing roses,1
happy elevator is happy,0
fifth degree burn,0
theres someone on the wingsome thing on the wing,0
dalai lama with japanese school kids,1
mr tea,0
i thought we came here to find intelligent lifeforms,0
keep walking nothing to see here hooman,0
rahm emanuel on a divvy bike,1
too far,0
so this is what euphoria feels like,1
friends shave their heads to show support for teenager battling cancer,1
the hoboken freeway just the way i am,0
ninja turtles,0
looking down the end of the house the window and the chocolate factory intro,0
fight with the black mamba snake,0
the almost neon like color of my ice tea,1
better,0
they stock a lot of weird stuff in the vending machine where i work,0
my friend paul having a terrible time at the beach,1
rockhard scissors on paper nsfw,0
cannington lake vegan and quite sucessful,0
cant wait for the next season to hit netflix,0
too subtle,0
blast off,0
hannah montanadoomsday,0
little fers are tough to avoid wpa,0
amateurs,0
the warning on this herbal drink do not over squeeze always swallow carefully,1
this sunbleached coke label,1
this map of a restroom outside the restroom,1
president truman reacts to the japanese bombing a small naval base circa,0
lifetime supply of democracy british situationist larry law in spectacular times,0
the creepiest so far,0
us tariffs steel and aluminium levies slapped on key allies,1
amy klobuchar pledges to fight everyday americans,0
the way this ice cube froze,1
this capybera and its children,1
stuck to trump,0
other discussions,0
she is hulking out,0
iidesuyo untitled,0
dabbing is invented in india,0
cutouts,0
say again,0
i did not know license plates glow in flash pictures,1
this guy doing a mary poppins,1
finally some noodz,0
the declaration of independence,0
found a green sriracha sauce,1
this jumping side kick,1
twins attack carjacker with fists and rubber snake,1
trump to visit inundated texas as flood levels from harvey continue to rise,1
player misses first world cup for birth of first child saying everybody says you only get one chance to be in a world cup but also theres only one day in your life where your children are born,1
other discussions,0
a plane flies in south africa over a dam as the sun sets,1
pot with an alien face,0
these roots looking like a troll hand,1
uber driverless car seconds before impact circa,0
strangers and a drone help rescue veteran trapped by nc flooding,1
a baby laying on its back stretching,1
this is not concrete or an ariel shot of new delhi its my living room carpet,0
running in montana,1
this helix nebula,1
katamari damacy fan art,0
so basically what youre trying to say with this sly wink is that i should go fuck myself,0
available here,0
gareth bale laughing at cristiano ronaldo,1
bleeding gums bearphy,0
ibex mine in leadville colorado,1
pupils at magna academy in poole banned from classes for pencil case infringements,1
a monkey in sunglasses riding a goat,1
the flash sitting down,0
i found a maybebaby moth crawling on my carpet,1
this toy horse heads shadow looks like a happy penguin,1
another car with a ridiculously small spoiler,1
this back hoe on curse of oak island is a special boy,0
whats the best laptop i had to make my own pc,0
a reference,0
whackakim,0
washington state waterfall,1
why is obama expanding surveillance powers right before he leaves office,1
i dont mind product placement but this has gotten too far,0
proper train,0
why are you leaving me,0
help me win a bet am i the only one to see the face,0
this guitar isnt impressed with your playing,0
anglozanzibar war,0
when you realise you reincarnated as an oil burner,0
precious eli,0
mark zuckerbergs dog,1
parents of pizza hut robbery suspect question why employee fatally shot their son in the head,1
good and evil,0
hurt me prada,0
heil hitgo wan,0
cutouts,0
ocean sunset,0
tsu,0
oh now i see it,0
hopes of accommodative fed spur wall street to fivemonth highs,1
cutouts,0
rare picture of the roswell martian,0
so i was melting down some pennies to get the zinc and some of the liquid zinc combined with the outside layer of copper to create a very thin layer of brass,1
sandra day oconnor sitting on the supreme court c,0
opposition leader andrew scheer awkwardly shaking hands with justin trudeau,1
my kitkat mini didnt have any crisp wafer,1
make it work feliners,0
i found an old picture my dad had drawn on microsoft paint and printed out,1
a sumo run participant in an inflatable suit with his dog,1
australia is not real its a hoax facebook star,1
my friend looking like hes holding something very important,1
you shall not pass,0
someone put this on the college vending machine,1
we dont make mistakes trump says right before making mistake,1
heres our colby it looks like she should be rollin on dubs low rider style,1
mokujin,0
i would do anything for love,0
cutouts,0
the film on my coffee matches the counter perfectly,1
one of my lights is longer than the other,1
aawwww yisss,0
i kinda ran with the back to the future thing,0
simpler shop,0
he comes bearing gifts,0
door handle dog,0
a sculpture of hitler on his knees,1
need a lift,0
the paws retreat,0
i decided i wont wear that pin on my chest,0
cutouts,0
jameis winston holding the national championship trophy,1
microways transphat,0
nbc plans a day long quiz show this fall,1
tanzania has become the latest country to implement a plastic ban from the st no one will be allowed to produce import sell or use plastic bags,1
uncle billy bobs ultimate pissing contest,1
a whole new world a dazzling place i never knew,0
in their rightful place,0
this mispriced toy at walmart my gf bought all of cents a piece,1
hey everyone we have a big announcement,0
japanese bomber sinks chinese submarine during the second sinojapanese war,0
this under water picture of a dog,1
lady gagas winter wardrobe,1
other discussions,0
this coffee shop uses a hay stack as a seat,1
but thats none of my business,0
empathy machine we see by water,0
when the light shines through just right,0
cutouts,0
women shall not drive carl xvi gustaf,0
this dialogue we do not understand it mexican student movement of,0
trump trying to kiss his wife,1
death star,0
pope francis gladly blesses parrot belonging to male stripper,1
police officer who arrested utah nurse gets fired from medic job,1
stuffed animal donations coming in,1
great shop reminds me of nina,0
stroking my dog whos a good boy,0
long billed curlew in the wood grain,0
salzerbach nothing is stable,0
kansas judge extends voting rights for those registered at motor vehicle offices,1
this teacher on a plane talked about her lowincome students passengers overheard and gave her more than in cash,1
hats for everybody,0
parents now spending twice as much time with kids as years ago,1
the scotchs im most proud of from my collection,0
nsfw,0
his legs are smooth,0
d,0
no one can figure it out,0
mummified buddhist monk comes back to life after years,0
found this at work the hose makes it kinda creepy,0
coming soon to a theater near you,0
traditional freedom day raising of the earth flag ol freebie,0
bad move zero,0
general kenobi,0
nissans twitter account gets hacked by lovestruck mexican trying to find his valentine,1
spotted this car on my way home dont know if it is actually a real one,1
eyes on you,0
life finally free a group of gondoliers has escaped from venice back to the open sea,0
grumpy ghost in hobby lobby today,0
hes yuuuge,0
so how did you two meet i bet thats a cute story huh,0
a bird in the hand is worth two in the bush,0
cutouts,0
no im not,0
tiny tiny little daihatsu van in japan,1
fooling the fat cats,0
this bottle is happy to open any beer for you,0
this should fix it,0
seattle judges throw out years of marijuana convictions,1
first picture of rapper drake after controversial conversion to islam,0
fuhring ze fuhrer,0
brown bear after bathing in water,1
where the hell did that come from,0
see through stall or reflection,0
little girl dressed as silent bob,1
a meteorite hitting a planet,0
good idea,0
the forest guardian,0
can we please get down now,0
court invader,0
huge kitty eyes,1
the mums who took cocaine during play dates,1
every states most popular house style,0
this cabbage was bigger than a basketball,1
this watermelon viking carving,1
this old ipad charger does not approve,0
stefan karl is laid to rest in a private ceremony,0
peanuts movie poster,1
fcc assures nation their favorite verizon websites wont be affected by net neutrality repeal,0
the stain my trash left on the ground looks like an ancient cave drawing of an alienancient species,1
save the adult humans,0
this is the best thing ive seen all day,0
these gas prices near my office,1
remains of the soldiers after the detonation of a fragmentation grenade,0
men carries bag of water,0
this square sucker,1
blooming cherry trees in bonngermany,1
the american government reacts to the murder of a russian agent on british soil,0
philadelphia international airport has a short story dispenser for kids you push a or minute button and the story comes out like a receipt,1
credit union social experiment turns out mostly successful,1
i know what to do,0
doggo wont bark anymore,0
chocolate softserve,0
whoa,0
in new jersey a prosecutors office an indictment and intimidation gov christies administration have quashed an indictment against the hunterdon county sheriffs office for political reasons,1
rapunzel,0
leashed cat climbing a tree while owner watches,1
blue steel,0
biglipped buddha in my custard,0
found this suspicious house in colorado a few years ago,0
donated to charity but we dont know plants and how do i use to be written in latin i believe,0
mediocre autopsy so far so bad,0
screenshot of a player during the sword art online incident seconds before becoming one of many victims within the game,0
wall,0
a lid that incorporates a environmentaly friendly noplastic straw feature without the cardboard taste of paper straws,1
bbbbut guys,0
court filings detail role of race in harvard undergraduate admissions,1
so tired,0
snow monster eating car,1
seamless,0
in mib office,0
she wins miss florida usa but when they see a photo of her makeup routine she loses crown,0
health law tax penalty ill take it millions say,1
you again,0
braineating amoeba found in louisiana water systems,1
you cant explain that,0
the red army and the red fleet reliable guard of the ussr ussr,0
quack,0
the death of julius caesar circa bc colorised,0
satellite photo of doha qatar,0
bj,0
these cans of beets with black and white labels,1
hey everybody its bob and david,0
this hotel room in silver springs md that provides the book of mormon as well as the holy bible,1
lincoln park zoo names baby camel alexander camelton,1
adjusting several sliders on recording studios mixing console pays off big time,0
sophie turner kit harrington sansa jon pouting,1
imprints of some chuck taylors in cement,1
i recently made album covers that follow a story line here is the first cover nostromocountdown,0
not even his final form,0
super shocked,0
a subway bench with different seat heights for different kinds of people,1
joel and ellie have their hands full,0
fourhour wolf of wall street edit to feature more sex and swearing,1
cyclecar,0
man inside a hay bale,1
one michigan company is gifting people with marijuana for their book purchases,1
dana white ufc donating million to vegas shooting victims,1
fiddy shades of grey,0
he who is not ready to die for freedom deserves the chains ca,0
my grandfathers tv stand is made from the old consul tv,1
eurostars problem with artillery shell collectors,1
dj durst the trap runs me,0
this cat caught mid yawn,1
man who became paralyzed in a motorcycle accident years ago sets out to race thousands in louisiana marathon after the marathon the chair used by the paralyzed racer will be donated so others can use it in future races,1
mice gone wild sfw,0
pret a manger under fire over its liberal use of coriander,1
sepp blatter hailed as combination of jesus christ nelson mandela moses,1
florida cop replaces elderly womans stolen engagement ring,1
the last supper,0
college football player has to give up the sport due to condition but team keeps him on scholarship,1
the plants inside of this well,1
first major drug distribution company former executives criminally charged in opioid crisis,1
donald trump leaked sex tape with stormy daniels circa,0
congo in crisis as president delays election,1
i say kind sir could you please stop stepping on my face,0
nestle executive pitches an idea to the board,0
my cookie was trying to be scary,0
the number of this flight between two colonial cities,1
this special baby water in mexico,1
abraham prepares his sacrifice to god bc,0
radishes ripening on the vine,0
this sign at a dublin railway station threatens a fine of irps weve used the euro for more than years,1
spains story intempo skyscraper built without elevator,1
cheers,0
us denies syrian state media reports of us missile attack on homs air base,1
your darling for everything,0
heres johnny,0
american bomber dropping refreshing pepsi on syrian air base,0
war of the world electric bugaloo,0
billy crystal,0
artwork on the side of someones garage,1
french woman savagely attacked by cats,1
my absoutely godawful first photoshop attempt ever,0
hes got bigger plans,0
woman with no regrets tattoo apologizes to clerk while robbing store police say,1
the mail men a fridge full of nati,0
my microwave oven allows heating at power,1
one photogenic grasshopper,1
this chicken is needlessly sassy,0
thanks to an askreddit thread and the generosity of several reddittors i got to see my eldest son graduate from high school,1
my seat looks complacent with its fate of being under a bottom,0
sad hulk,0
some things never change,0
other discussions,0
this cat begging for belly rubs,1
after using a fork for years to hold down the lid for a cup of noodles well today i found out the outside packaging snaps on to hold the lid down,1
an unidentified individual from south carolina encounters a clown,0
alternate ending,0
fbi arrests leader of rightwing militia that detained migrants in new mexico,1
happy lil fella,0
softball player stretching,1
bc carthage,0
where u go,0
for allegedly brutal prison guard day of reckoning arrives on friday rollin suttle austin and other corrections officers were abruptly fired by florida department of corrections secretary michael crews in connection with the deaths of inmates in prisons across the state,1
woman in park pouring herself a drink,1
my uncles bangs in this childhood photo look like a hand on his forehead,0
supreme court rules in favor of most buckwild pride parade nations ever seen,0
bruce buffer midannouncement,1
the white strips colorblind,0
egg cooker is surprised,0
i see you looking at me with those looking googling eyes,0
mr cousteau was present for the maiden voyage,0
cutouts,0
million dollars,0
almostthere,0
nsfw,0
bbc las vegas shootings tales of heroism emerge from aftermath,1
this daddy long legs has legs,1
the pancakes of the caribbean,0
us energy officials hail freedom gas molecules of freedom,1
lee harvey oswald moments before jack ruby killed him in dallas tx,0
ariana grande and bishop charles h ellis iii at aretha franklins funeral circa,0
elderly man healed by unexpected bond with young girl,1
hes seen things man,0
plea for british women to enter factory work,0
figured reddit might like my wifes new cat skirt,0
dinosaurs eating him now also frankie macdonalds is there,0
cutouts,0
reactor online catnip online kibbles online all systems nominal,0
image from lindsay lohans super weird photoshoot from,1
car completely burned,1
a panda bent over on a sidewalk,0
naked lady on the beach nsfw,1
teens promnight splurge will cheer homeless women,1
how my cables fit,1
tree branch grows out and then straight up like another tree,1
it burns,0
summer days hot chocolate and marijuana,0
antiskateboard device on a low wall at ventura harbor ventura ca,1
delicious christmas tree sometimes pinterest ideas do work out,1
horses nose and mouth looks like a smaller head,0
this is brad he loves unicorns this actually happened have fun hes a good sport,1
other discussions,0
another win for the pastafarians,0
super intense hipster child,1
paralyzed man becomes first person to feel sensations through a prosthetic hand connected to his brain,1
