text with images,2_way_label
dancer in alley road,1
this extremely excited shaft wants to hug,0
a fat running hamster photo by julian rad austria this is the overall winner of the inaugural comedy wildlife awards,1
its adorable,0
heeheehee,0
janitor throws wild party at school for birthday,1
virtually strangers awkward pause,0
barathrites suffrage once given,0
man in undersea habitat,1
meet the rollettes the wheelchair dance team that will wow you,1
turton tower england,1
the democratic debates ce,0
business taking comedic advantage of being located in humble tx,1
this photo of vladimir putin,1
this little guy blends with the cement floor,1
more than one,0
udodisbryan,0
crossfit girl with crazy about to poop herself face,1
my only regret is that i have no time to do a dramatic look,0
giant golfer or tiny score keeper,0
ah i could have sworn i was laying on my back,0
richard m nixon and elvis presley at the white house,0
short story dispenser at a local coffee shop that prints out and minute long stories for free,1
camera man,0
rfakehistoryporn subscribers as they attempt to read a series of basic instructions,0
the international communist and labor movement the vanguard of the revolutionary forces of the world soviet poster from,0
prime minister winston churchill watching a football match circa,0
arcade seats seen som sht,0
here is what my suggestions look like,0
do not resist under the fold,0
equifax being blackmailed and tortured into giving up the admin passwords,0
hitler giving the nazi salute to glorify the german nation as everybody around him screams heil hitler,0
evil mazda d,0
cutouts,0
other discussions,0
yoyoing,0
santas rigging the system this year,0
i dont know how to photoshop,0
america joins the war and sympathizes with marianne,0
easy to spot the moldy ones,0
went to lunch at discovery cove came back and found this octopus,1
dog in a field,1
maldives police arrest reporters at press freedom rally,1
patriothole be vigilant george soros has a second ticket to a screening of baby driver and just declared that the most violent leftist will get to go with him,0
dont get it twisted yo,0
anyone hungry,0
jaws wide open,0
got one of the best technic lego sets for,0
diet and exercise help maintain weight loss,1
philadelphia city officials order man to stop cleaning up trashfilled vacant lot,1
available here,0
spot on great advice,0
found in a random antique shop,1
fir trees,0
delicious,0
and they lived happily after,0
this chair is winking at me,0
texas police rescue kitten stuck underneath car in traffic,1
marianne williamson deletes tweets about using mind to control weather after realizing nation unprepared to wield such great power,0
oh no there goes tokyo,0
this arugula with a single flower,1
napoleon bonaparte on trial for his crimes color,0
death of marie sklodowskacurie,0
but there naked and bangin,0
reddits input to the parade,0
excited pageant girl,1
a dolphin,0
its his favorite show,0
george washington crosses the delaware river,0
theres what on my head,0
heres another,0
first time seeing a quadruple a battery,1
rebar saw i found in the philippines,1
my local walmart has a mildy interesting urinal slash guard,1
uk conservative party circa,0
the end of my mcdonalds straw got pressed with the wrapper,1
ooooo,0
china fights on usa s,0
fisherprice recalls dangerous foottall high chair,0
i guess thats the way the whole durned human comedy keeps perpetuatin itself,0
monkey playing in the span of a good boy,0
i bought a small mirror for an art project where one side is a conventional second surface mirror while the other side is a much fancier first surface mirror cost about dollars,1
new behind the scenes image of thors hammer,0
israel among the least religious countries in the world,1
girls who code an organization focused on closing the gender gap in tech has raised million from lyft riders since the ridehailing company added the nonprofit organization to its round up donate program last year,1
castlelemon,0
hello there enjoy your meal,0
communism will be abolished,0
flying football players,0
shes just clubbin,0
so not rasist,1
i found a real life upvote,1
this bill from hasnt been folded at all compared to a bill from,1
barbecue explodes runaway pig corralled on barrie street,1
httpiimgurcomlwlteejpg,0
shellshocked us soldier,0
deleted scene from the first cloverfield movie,0
alcazar temple of the minds eye,0
the regal ringneck snake,1
fiat spider rebuild,1
this picture of f world champion nico rosberg,1
mad cat furry road,0
in the name of peace soviet space race s,0
black swan duck,0
measles cases in us rise to,1
this rugby player and his ball,1
other discussions,0
found upvote from potato field,1
this guy was really happy to be there,0
cias facebook program dramatically cut agencys costs,0
elite years of putting the joy in joystick,0
people leaving san siro football stadium in milan make you believe the entire spiral structure is moving,0
this dog driving a childs car,1
whats the strangest thing you have successfully roasted over a fire,1
everybody likes a good corndog,0
john cusack from say anything,0
alaska airlines plane flew with worker trapped in cargo hold,1
i have a possessed pepper plant every third or fourth pepper seems to have a scary demonic face ironically they are not hot and very sweet the plant was wrongly identified as a datil imho the best pepper ever i found a ghost pepper label buried in the pot spook pepper is more accurate,0
help me,0
india starts work on rhino dna database to curb poaching,1
charity group bidyanondo is set to launch their bashanti brand of sanitary napkins in bangladesh this month at a price of just a nickel each,1
these skeletons doing yoga,1
looks like someone had a wild night in our alley,1
wallace and yankee,0
this speedlimit sign imbedded in a tree,1
this horse derping out,0
attorneys general launch antitrust investigation into google,1
rdj with an indulgent smile,0
the big three rebound king meet at yalta,0
preschool taking heat after field trip to gun range,1
how my cousin who has never had pizza before holds his pizza,1
stencil stencil indie,0
granny jordan,0
doctor nurse reunite with patient they saved years ago,1
obituary describes woman as evil and violent,1
reign of fire,0
german footballer thomas muller,1
this hospital cabinet seems happy with its work,0
compromise with the south s thomas nast us pro union pro war,0
warm waters,0
other discussions,0
oh god what did you say you want to do here,0
dog happy with his new stick,1
bad gamer joke,0
elite british bridge player drops dead from excitement after playing rare winning hand,1
ec threatens to unleash belgian sausage war,1
historical graffiti inside a cave circa,1
this unimpressed dog holding a snack in its mouth,1
frozen mercedez logo on a car,1
my monopoly variation had an inspectors tag with an anticapitalist message and the die had an imperfection,1
a copy of the statue of liberty on a random roundabout on a france road,1
available here,0
this clock for tides,1
suv carrying barbecue grill explodes when florida woman principal reassigned after trying to kiss it,0
down set hut,0
so hes a time traveler too,0
to lose fleet carriers without inflicting equal losses to the enemy would be a disgrace,0
cutouts,0
wwe bear,0
for me and country,0
smells good man,0
this paint damage that looks like a surprised cat,1
these snow patterns on a chairlift at deer valley ut,1
bill and hillary with balloons,1
overly excited mario kart rd place guy,0
demon child,1
putin quips hes ready to grant asylum to exfbi chief comey,1
brick face,0
dogs arent supposed to be on the furniture,0
teddy bear girl reunited after fort lauderdale airport shooting,1
this weird watermelon without lines at target,1
suddenly,0
kitten taking a hit of whipped cream,1
ay im tryna eat ova heaa,0
mitt romney appreciates cloud daily intel,1
pro hijab head covering billboard modern religion,0
this lake i took a picture of,1
use one two or all three,1
man on cusp of having fun suddenly remembers every single one of his responsibilities,0
someone printed their picture on the wrong side of the paper,1
look closely,0
early version of kermit the frog,0
hufflepuff signs shaq,0
then and now,0
this kid handing out forks at lunch,1
swiss antiimmigration poster,0
uganda bride price one womans battle for equal rights,1
this bicycle shaped pizza cutter,1
i found a rare silver squirrel,0
long tongue,0
bus shelter built on road with no bus service in yorkshire,1
joseph goebbels upon realizing that alfred eisenstaedt the photographer was jewish x,0
beware of crocodiles in lake wendouree,0
id run too,0
theres an old japanese man embedded on this wall,0
after a long voyage christopher columbus spots land,0
this lightning looks like its being fired out of hand zeus will destroy all,1
too subtle to notice,0
jeff davis president of traitors robbers and pirates united states american civil war exact date unknown,0
forest whitaker,0
this dog footprint on my friends stairs,1
does this count ig artsynthetic,0
man goes the distance for tiny hummingbird his dog helped rescue,1
my remote is rather horrified at the horror movie i am watching,0
cat drinking from a bathroom sink tap,1
shauna coxsey climbing this boulder problem,1
my cat had to have one of her upper canines removed so her lower canine is poking her gums and now shes stuck with a permanent evil smirk,1
moss growing on concrete from years of showering,1
darby ogill,0
pope blessing a pope,0
newspaper machine gunner,1
white rock bc as seen from white rock pier,1
clarence seedorfs leg muscles,1
sports bra after gym,0
austria trains collide near vienna about a british citizen of iranian martyr hojaji,0
hello yes this is dog can i help you find a book,0
this house is the same color as the porta potty parked outside,1
f racer,0
the last of your nine lives,0
i just baked some dog gone yummy cinnamon rolls,0
huge explosion in a city,0
diogenes responding to zenos dichotomy paradox bc,0
little girls absolute joy after beloved pet dog ace returns home after thieves stole him a year ago,1
one of my stoves knobs is only odd numbers,1
the things this camera has to see,0
this indian restaurant has a photoshopped picture of ghandi as a chef at the back of their menu,1
idaho boys toy gun prompts two school lockdowns,1
leos escher body,0
this guacano in patagonia,1
chris evans and aaron taylorjohnson,1
this life saver gummy with a completely wrong placed hole,1
the new receptionist for the president of the us is deaf she uses an interpreter and is the first person to welcome many foreign dignitaries to the white house,1
cutouts,0
i wouldnt even be sad,0
not so photogenic on a bad hair day,0
slightly bemused,0
finnish sniper simo hayha during the winter war,0
amazon is selling rpgs now i see,0
moon over clouds dfw,1
finished wrapping my brother in laws christmas present,1
he wrote a song about his moms cancer thats when famous musicians sent him their version,1
reno starbucks customers pay it forward a whopping times,1
found this s radio shack newspaper ad,1
chris paul passing out an assist,1
that wasp seems to be walking in thin airbut its actually stuck between two sheets of glasses,1
hard times,0
they arent doing it right,0
an alternate title was considered,0
th washington dc martin luther king jr has his famous speech against racism at the lincoln memorial,0
reddit salt miner,0
brooklyn da prosecution of low level marijuana cases down percent,1
first halloween themed car so far,1
this sliced mushroom that looks like a skull,0
a lone cloud in an empty landscape,1
freeze,0
scientists discover adorable new species hiding in the junk drawer,1
daniel plainview mines the worlds first bitcoin circa,0
watering the flower,0
should i play fallout james franco is mad on how the other lion that died with cecil the lion was teaching a seminar on dank memes,0
taking a picture of burnt marshmellows with the flash on makes it look like aluminum foil,1
terror inc forcing happiness,0
tsar pope and the rich on the workers shoulders russian civil war,0
this walmart sign in new jersey is red,1
this restaurants way of telling you to get the hell off your phone,1
this dog straddling this sofa,1
monty python and the holy grail alternate ending,0
the urinal sensor at disneyland blushed,0
food chain,0
my tictac could stand up,1
chariots of fire,0
gotta go fast,0
awkward ninja attack,0
anyone else see et here,0
lance armstrong must pay million to prizeinsurer for lying,1
majestic polar bear on a rock,1
run away,0
man going to trust societys determination that he deserves his privilege,0
de blasio employee arrested for child pornography,1
cruella de vil wasnt playin,0
stocks close higher for fifth straight session as dow reclaims level,1
false it will be fantastic,0
rudy giuliani squinting after soomebody broke his glasses,0
panera to remove preservatives additives unacceptable ingredients from menu by,1
a carpet with a cool pattern,0
the guts of a piano,1
annexation of crimea by the russian federation,0
pieta,0
my mother inlaws toilet paper holder is a mini outhouse with storage for more rolls,1
bloody sunday sanders,0
pray to gaben for me to keep up with new ram pc wont boot,0
just a chllin asian dude livin the life,0
im excited to be here,0
churchs stolen rainbow flags spark nationwide show of support,1
the leftovers dreamin in color,0
sir pantsalot,0
napoleons story is recorded for the first time circa,0
at the hotel i was at they had dispensers so people couldnt steal the toiletries,1
suns reflection on mirror license plate creates a cool shadow,1
on top of the world,0
my girlfriends brother drinking from the hibachi bottle,1
bataclan concert hall will reopen despite paris attacks,1
lego tracks down rare train set for aspergers boy who saved up for it for two years only to discover it was no longer made,1
tiny frog in a bottle top,1
turkeye,0
dreamville sacrifices,0
cleveland balloon launch,1
shark couture,0
this dictionary word for onanism,1
professor oak from pokemon origins,1
looks normal to me,0
head swap,0
ahem,0
im already banned from rpyongyang,0
a mothers message inspires central cougars senior,1
the russians are at it again,0
otto warmbier dies days after release from north korean detention,1
formerly homeless vet now helping others change lives,1
build ready whelp im placing the parts i intend to reuse ssd and my nzxt s front panel with no errors or bsods,0
scotty p grew up and turned his life around,0
the air guitar world champion,1
this dog is chewbacca,1
a dog being a seal,1
gun homicides on the rise cdc says,1
senior labour mp wants to decriminalize shoplifting from luxury stores,1
photo captures servers touching act for yearold veteran server ate with this man during his lunch break because he had no one to talk to,1
this hairless guinea pig,1
bought a pack of socks that came with three different pairs one of those pairs had three socks,1
but when he was younger,0
is amazon actually giving you the best price,0
cutouts,0
i followed this grumpy guy for a few blocks today,0
thumbs up,0
wife dies husband wins lottery next day,1
cpr marathon more than two dozen responders resuscitate neighbor for minutes,1
ceiling lights reflected on windows looks like newark airport invaded by ufos we will not go quietly into the night,1
this yellow watermelon,1
the remains of an old paddlewheel i found on s river bank,1
breaking the news,0
detailed picture of a galaxy,0
did someone say meta,0
frank ocean blonde,0
china seizes rolls of toilet paper printed with image of hong kong chief,1
this squirrel having a cigarette,1
my friend riding a luge across the finish line,1
this iron at the hotel i stayed at has a little light on the front,1
sex ed can get pretty awkward,0
man holding a family size box of cheerios,1
a forest during sunrise,0
this confusing paint shadow of a toilet seat,1
mcconnell vows gorsuch confirmation this week says nuclear option in hands of democrats,1
metallica fans to perform day of service at food bank,1
i dont know,0
years after death dostoyevsky undergoes criminal check in russia,1
the new terminator,0
everyone should try it at least once,0
reeltoreel monkey,0
my fortune had an error when being typed,1
peeing techniques,1
man who was critically struck in the head with a baseball bat that flew feet towards him like a rocket receives almost in donations to pay for expensive brain surgeries and is hoping to make a full recovery,1
divorced mother of two donates kidney to her dying boss then things get really weird,0
john maus decide decide,0
make love not woodchuck,0
an indoor pet restroom at the airport,1
girls doing an acrobatic trick,1
a kinda hope you guys make this happen in the same way that im kinda hoping for a zombie apocalypse,0
some people think you can catch aids from a glass you cant,0
notorious mobster al capone counts his money circa chicago colourized,0
watermelon shark,1
my boyfriends shower curtain looks a little too confident about watching me pee,0
a worm snake found at summer camp,1
mafia boss baby,0
adrian wojnarowski on twitter kasich just announced its plan to diversify away from clinching the premier league title,0
theres a fly on your screen,0
cutouts,0
untitled,0
halo reach emile cosplayer showing off,1
massive dust storm envelops east coast as hillary clinton brushes off bible to court evangelicals,0
doldrum corp we dont care,0
we have a text for help number at our plumbing supply shop for customers looking for older parts we just received this,0
dennis rodman wants a nobel peace prize,1
majestic,0
smashing,0
cool headless penguins dont look at explosions,0
jr smith of the new york knicks,1
sony hackers threaten attack on movie theaters that screen the interview,1
this vine squishing this grape,1
jt down to earth,0
bobby riggs knocks out billie jean king after losing straight sets in the famous battle of the sexes tennis match,0
this bug in my pistachio,1
humorous sovietstyle commercial by adult swim,0
paul manafort starts new job lobbying prison guards on behalf of aryan brotherhood,0
there is a tiny spirit in my ice cube,0
my friend trying out for the quidditch team,1
canned meat,0
formula driver after becoming world champion,1
every step you take ill be watchin you,0
something so trivial,0
the bank gave us a bunch of old penny rolls these ones were all dated,1
lady gaga and choreographer going over her lyrics in preparation for super bowl li,0
other discussions,0
the name of this nut company,1
attempting to pick up an angry mini schnauzer,1
fox news viewers less informed than those who watch no news at all,1
corgi derp,1
two days before the greeks defeated troy circa bc,0
mph lap of the winter,0
leaked footage of fantastic reboot,0
novak starting a new sport,0
friendly car driving in front of me today,0
something is really gnawing at this guy,0
jack and bernie,0
my martini is as drunk as i am,0
im gonna avoid the trump joke and do this,0
my nail polish is exactly the same color as the interior of this bus,1
the badlands south dakota,0
alien invasion scenery in this venice night sky,1
pug in a helmet riding a pony,1
in the sky zone,0
boris johnson rugby tackling a kid,1
baby geese leaving the nest for the first time,1
theres waldo,0
the beatles introduce modern dancing to the world on the ed sullivan show,0
a boy and his costume,1
apparently im an year old,0
other discussions,0
dacoits in ghotki accuse police of extorting money,1
couple to marry at cleveland hopkins baggage claim where they first met,1
truck carrying truck carrying truck carrying truck,1
structure blocks make mirrors easy and they are not native to north koreas kim wants to renegotiate climate accord,0
woman saves officer by jumping on suspects back during struggle,1
cutouts,0
trump dines at dc hotel after spending day at trump golf course,1
eu searching computers for memes,0
irnss no clap of thunder,0
its him,0
maybe in our world there lives a happy little tree over there,0
this picture of terry crews,1
im ron fucking swanson i was born ready,0
a fisherman on the phone with a hook through his hand,1
italian football squad winning the world cup circa,0
bahe formation the power of ideas,0
the burning hell tick tock,0
just saw the end of a rainbow on the bus,1
jabba the pug,0
mum,0
rust makes a perfect yin yang symbol,1
this jet with a jets paint job,1
now its sfw,0
cat swiping at an owl,1
today i made a corn dog that looks like an elephant,0
this british halfpenny from my friend had,1
my grape was having a rough wednesday too,0
reading cursed childjust found out that moaning myrtles full name is myrtle elizabeth warren and i cant get over it,1
cutouts,0
these bananas are uncommonly straight,1
these twoinone llamas,1
rotting leichhardt shack sells for just shy of million,1
person riding a gigantic gazelle statue,1
almost didnt want to eat it,0
baby painted turtle shying away from the photo,1
picture of the driver,0
kerry rebukes israel calling settlements a threat to peace,1
experts wanted strike date changed because of weather i gave them the idea that clouds will help escape radars pm modi,1
my hat just being a cartoon whale,0
creation of hedgehog,0
img,0
upset stomach,0
when you spot the hero killer,0
mall of america nations biggest hires first black santa,1
there is an arrest warrant out for jill stein,0
cutouts,0
rough landing,0
irans flower industry ready to bloom globally,1
islands in the bahamas,1
utah just became a leader in digital privacy,1
man allegedly vapes another dudes semen for,1
sheltered weaklings by takashi kono poster,0
even more likely,0
gooooooooooooaaaaaal,0
my smallest photoshop ever kb,0
epa chief pruitt welcomes delegation of pollution from china,0
orange influenza virus,1
my slurpee cup wet spot is smirking at me,0
the master at her canvas mom just brought in a pretty averagelooking rock from the woods that she says she will use in a project,0
ghost rover,0
some geese obeying traffic rules,1
bruning the last bulwark of freedom and order centre party poster from the german federal elections,0
chickfila makes rare sunday delivery for boy with brain tumor,1
my man proposed in front of customers from the jar and my fellow trolls what every little girl dreams of,0
girls sweet party ruined by piles of feces falling from passing airplane,1
parkour with a touch of class,0
this adorable ball of fluff,1
too much foam made a friendly drinking buddy,0
this swim ring has different warnings for australian british and american english,1
rapper eminem with his new born daughter c,0
httpsiimgurcommvvuwfhjpg,0
fort mcmurray hamsters rescued during fire evacuation get visit from premier,1
this mirage above the mirage,1
my car door is getting tired of getting slammed,0
i wanted mayo you utter clot,0
little snake peeking from a window,1
quasi the hunchback of notre dame the great senor wences,0
kim jongun overcomes dynastic fear of flying,1
i gave the poor guy a friend,0
black and white vintage monochrome s jump puddle,1
th,0
someones ready for star wars,0
us soldier carrying his severed arm on the beaches of normandy,0
trapped soul in a cheap clothes store,0
homeless man makes selfless sacrifice to help stranded young couple,0
this car is covered with in pennies,1
in post net neutrality america ajit pai seeks a new life in the pizza industry,0
zack snyder explaining batman v superman during an interview after its premiere,0
minutes before their ceremony bride grabs her grooms shaking hand and she immediately starts crying,0
these patterns on a champagne box dont pertrude from it at all,1
layers in my cup after each sip of coffee i drink coffee using a straw,1
inspiring stories youre never too old to dream,1
this artery i found while preparing chicken breasts,1
hahaha i switched out his medical charts with the lady down the hall before his surgery,0
heres adam,0
rain x windshield blade on the left and a cheap windshield blade on the right,1
the most sleepdeprived state in america will surprise you,0
immigrant terrorists,0
guys it isnt funny anymore,0
this baby moorhen with silly feet,1
ive made a huge mistake,0
awww here its for your desktop wallpaper,0
resist i must,0
repost requested from rgaming,0
ucf campus shooting survival class attendance low despite foiled massacre,1
state trooper unknowingly pulls over the officer who delivered him as a baby years ago,1
texas republican called ice on sb protesters threatened to shoot colleague,1
such a lonely day,0
my coffee machine is a clown showing his tongue,0
smile,0
midnight the mass,0
couldnt resist,0
britain is forced to declare war on germany after the invasion of belgium escalating the first world war,0
while were not looking,0
redditshoutout,0
first time ive seen a street vendor in la who accepts card,1
kayaking palmer,0
full moon self titled,0
hockey fans celebrate goal by throwing teddy bears onto ice for charity,1
old guy giving kimye a sideeye,1
jimmy carters wish to rid the world of the guinea worm is close to becoming a reality,1
first kid to wake up at slumber party gets exclusive look at friends moms morning routine,0
raptors on alert,0
cutouts,0
the queen of england on the side of a minivan,1
bieber loves his fans,0
accidentally cut a hole in my hand,0
el circle of life,0
video darn it,0
some salt crystals growing on ancient playdoh,1
moo,0
angry rutgers coach fired what a face,1
waiting on the bus stop,0
an office workers war creed heppenstal co steel forgings artist tom hall,0
bbc news turkey wedding blast more than dead and hurt in gaziantep,1
this flavor gradient gummy bear centipedeorange pineapple lemon,1
the ceiling above the slurpee machine at has seen some action,1
herd helps baby elephant caught in snare,1
photobombing turtle,1
just moved from texas to foothills nc the altitude change cause the kcups we brought to pop up while the ones we purchased here are flat,1
psychedelics stagefright,0
palmer luckey is funding donald trumps internet trolls with his oculus money,1
a scan of a healthy brain,0
this friendly sidewalk giraffe,0
